date,player,team,source,snippet,url,title
2025-11-28,Anthony Davis,,x.com,"Mike Curtis: Jason Kidd on making sure Anthony Davis is in a good mental space considering he's drawn some ire from the fanbase: ""The biggest thing is the train keeps moving, no matter of a trade or a dismissal. You gotta keep moving. For AD, it was to focus on his body, come back healthy. He's ready to go..."" x.com Dallas Mavericks , Trade , Jason Kidd , Anthony Davis",https://x.com/MikeACurtis2/status/1994601681007645106,"""The biggest thing is the train keeps moving, no matter of a trade or a dismissal. You gotta keep moving."
2025-11-28,Max Christie,,x.com,"Mike Curtis: Max Christie on being back in LA for the second time since he was traded in February: ""It's the same. I mean I was here last year, too. I'm a Maverick so I'm not really thinking about it like that. It's just another game. It feels good. It's cool to be back. Just another game."" x.com Dallas Mavericks , Trade , Max Christie",https://x.com/MikeACurtis2/status/1994513129993384269,"It feels good. It's cool to be back. Just another game."""
2025-11-27,Russell Westbrook,,hoopshype.com,"You had a footnote in the book where you wanted to speak with D’Angelo Russell about his first stint with the Lakers, and he said he didn’t have anything good to say about them and could talk with you then and there, and then funny enough, he gets traded to the Lakers six months later. Did you find a lot of other former players who had animosity towards the Lakers? Yaron Weitzman: I did not get much animosity. Russell Westbrook did not want to talk. I'm guessing there would be animosity there, but he didn't talk to me. I don't wanna say animosity, but I got the impression that Josh Hart's experience there was not great that first year with the Lakers. But honestly, none of those guys had a good experience. I spoke to Brandon Ingram about it and he acknowledged that it was tough and some things LeBron did that year frustrated him. But he also said, looking back, I was immature and looking back, I understand, I have more understanding of it. HoopsHype Los Angeles Lakers , Trade , Russell Westbrook , D'Angelo Russell , Brandon Ingram , Josh Hart",https://www.hoopshype.com/story/sports/nba/2025/11/27/yaron-weitzman-qa-i-think-laker-fans-would-have-expected-more-than-one-title-with-lebron-james/87473819007/,"I did not get much animosity. Russell Westbrook did not want to talk. I'm guessing there would be animosity there, but he didn't talk to me. I don't wanna say animosity, but I got the impression that Josh Hart's experience there was not great that first year with the Lakers."
2025-11-27,Anthony Davis,,youtube.com,"Tim MacMahon: Trading AD is a real possibility—and I would even say likelihood—this season. Trading Kyrie is not something that's on the Mavericks' priority list, or it's just straight up not something that they are interested in doing right now."" YouTube Dallas Mavericks , Trade , Kyrie Irving , Anthony Davis",https://www.youtube.com/watch?v=h7fcpo74I_I,"Trading AD is a real possibility—and I would even say likelihood—this season. Trading Kyrie is not something that's on the Mavericks' priority list, or it's just straight up not something that they are interested in doing right now."""
2025-11-27,Lamelo Ball,,youtube.com,"Andre Miller: I’d like to see Devin Booker get to another team. He’s almost getting lost in the sauce a little bit because the team isn’t winning over there. But I want to see Devin Booker on the big stage because I’m a huge fan of his. And then LaMelo Ball — I’d like to see him on another team, too. Just to see him deal with some pressure and see how he can actually lead a team in the playoffs. YouTube Phoenix Suns , Trade , Andre Miller , Devin Booker",https://www.youtube.com/watch?v=UnXjE_50RHc,I’d like to see Devin Booker get to another team.
2025-11-27,Kyrie Irving,,youtube.com,"Tim MacMahon: So Kyrie signed—uh, it wasn't even an extension. He—he opted out and signed a three-year deal this summer. So he's got this year and the next two."" ""What I would tell you about Kyrie is the Mavericks do not want to trade him."" YouTube Dallas Mavericks , Trade , Kyrie Irving",https://www.youtube.com/watch?v=h7fcpo74I_I,"""What I would tell you about Kyrie is the Mavericks do not want to trade him."""
2025-11-26,Keon Ellis,,hoopshype.com,"The Indiana Pacers have been among many teams to express interest in Keon Ellis this season and have previously targeted him, league sources told HoopsHype. HoopsHype Indiana Pacers , Sacramento Kings , Trade , Keon Ellis",https://www.hoopshype.com/story/sports/nba/2025/11/26/title-nba-intel-ja-morant-timberwolves-kings-celtics/87477567007/,The Indiana Pacers have been among many teams to express interest in Keon Ellis this season
2025-11-26,Anfernee Simons,,hoopshype.com,"Over the summer, the Brooklyn Nets and Celtics discussed several trade scenarios involving Simons that ultimately fell through, league sources told HoopsHype. The Milwaukee Bucks also kept tabs on Simons, HoopsHype has learned. HoopsHype Boston Celtics , Milwaukee Bucks , Brooklyn Nets , Trade , Anfernee Simons",https://www.hoopshype.com/story/sports/nba/2025/11/26/title-nba-intel-ja-morant-timberwolves-kings-celtics/87477567007/,"The Milwaukee Bucks also kept tabs on Simons, HoopsHype has learned."
2025-11-26,Anfernee Simons,,hoopshype.com,"Getting below the luxury tax entirely could conceivably be achieved by trading guard Anfernee Simons or shedding the salaries of Sam Hauser and another minimum-salary player.   Simons is in the final year of his contract worth $27.68 million, while Hauser is beginning a four-year, $45 million contract extension this season.  With that in mind, Boston hasn’t shown a willingness to attach a first-round pick to trade Simons’ expiring contract, league sources told HoopsHype. HoopsHype Boston Celtics , Trade , Anfernee Simons , Sam Hauser",https://www.hoopshype.com/story/sports/nba/2025/11/26/title-nba-intel-ja-morant-timberwolves-kings-celtics/87477567007/,"Boston hasn’t shown a willingness to attach a first-round pick to trade Simons’ expiring contract, league sources told HoopsHype."
2025-11-26,Giannis Antetokounmpo,,hoopshype.com,"The Milwaukee Bucks have conducted background due diligence on Zach LaVine and others around the league, as usual, sources told HoopsHype. However, nothing is imminent as Bucks superstar Giannis Antetokounmpo nears a return from a low-grade adductor strain. Should Milwaukee’s interest in LaVine become more serious, it’s worth noting that Bucks forward Kyle Kuzma and Kings Governor Vivek Ranadive both invested in a new women’s professional sports venture called Major League Volleyball, and Kuzma has been linked to the Kings via trade rumors for several seasons. HoopsHype Milwaukee Bucks , Sacramento Kings , Trade , Vivek Ranadive , Giannis Antetokounmpo , Zach LaVine , Kyle Kuzma",https://www.hoopshype.com/story/sports/nba/2025/11/26/title-nba-intel-ja-morant-timberwolves-kings-celtics/87477567007/,"The Milwaukee Bucks have conducted background due diligence on Zach LaVine and others around the league, as usual, sources told HoopsHype."
2025-11-26,Anthony Edwards,,hoopshype.com,"Timberwolves superstar Anthony Edwards is considered untouchable by the franchise, while forward Jaden McDaniels is viewed as close to untouchable as well, league sources told HoopsHype. HoopsHype Minnesota Timberwolves , Trade , Anthony Edwards , Jaden McDaniels",https://www.hoopshype.com/story/sports/nba/2025/11/26/title-nba-intel-ja-morant-timberwolves-kings-celtics/87477567007/,"superstar Anthony Edwards is considered untouchable by the franchise, while forward Jaden McDaniels is viewed as close to untouchable as well,"
2025-11-26,Ja Morant,,hoopshype.com,"Following an argument with Grizzlies head coach Tuomas Iisalo and a one-game suspension for conduct detrimental to the team, rival NBA executives circled like vultures conducting due diligence to see if the Ja Morant era in Memphis was nearing an end. However, Grizzlies executive Zach Kleiman declined trade inquiries on Morant then and has since, for the time being, league sources told HoopsHype. HoopsHype Memphis Grizzlies , Trade , Ja Morant , Zach Kleiman , Tuomas Iisalo",https://www.hoopshype.com/story/sports/nba/2025/11/26/title-nba-intel-ja-morant-timberwolves-kings-celtics/87477567007/,"However, Grizzlies executive Zach Kleiman declined trade inquiries on Morant then and has since, for the time being, league sources told HoopsHype."
2025-11-26,nan,,hoopshype.com,"While Edwards and McDaniels are viewed as young pillars for the Timberwolves, Minnesota’s due diligence on Morant signaled the team’s desire to upgrade at point guard and will continue to be on the agenda leading up to the trade deadline, league sources said. HoopsHype Minnesota Timberwolves , Trade",https://www.hoopshype.com/story/sports/nba/2025/11/26/title-nba-intel-ja-morant-timberwolves-kings-celtics/87477567007/,"Minnesota’s due diligence on Morant signaled the team’s desire to upgrade at point guard and will continue to be on the agenda leading up to the trade deadline, league sources said."
2025-11-26,Lonzo Ball,,youtube.com,"Lonzo Ball: Unpopular opinion probably though I feel like I could have played with D’Angelo Russell honestly. I think they should have just maybe just kept all these picks and just see how it would have went but I mean they still got the ring so, you know, worked out for them . YouTube Cleveland Cavaliers , Los Angeles Lakers , Trade , Lonzo Ball",https://www.youtube.com/watch?v=S68ZtX2sRXU&t=2360s,"honestly. I think they should have just maybe just kept all these picks and just see how it would have went but I mean they still got the ring so, you know, worked out for them"
2025-11-26,Nick Richards,,marcstein.substack.com,"Phoenix has made Nick Richards available for trade since this past summer, league sources say. I've also been told that Portland is forecasted to be more willing to move Robert Williams III this season compared to last season, when the Trail Blazers maintained a high asking price for the oft-injured big man. marcstein.substack.com Phoenix Suns , Portland Trail Blazers , Trade , Robert Williams , Nick Richards",https://marcstein.substack.com/p/talking-zone-defense-nba-big-men,"Phoenix has made Nick Richards available for trade since this past summer,"
2025-11-26,Jonathan Kuminga,,marcstein.substack.com,"Sources say Golden State did discuss the pursuit of Domantas Sabonis before the 2022 trade deadline that featured Indiana shipping the Lithuanian lefty to Sacramento for a package headlined by Tyrese Haliburton. The Pacers were known at the time to be big fans of Jonathan Kuminga, leading to various discussions between the two front offices that featured current Warriors swingman Buddy Hield, former Warriors swingman Andrew Wiggins and Sabonis in various frameworks. marcstein.substack.com Golden State Warriors , Indiana Pacers , Miami Heat , Sacramento Kings , Trade , Andrew Wiggins , Domantas Sabonis , Buddy Hield , Tyrese Haliburton , Jonathan Kuminga",https://marcstein.substack.com/p/talking-zone-defense-nba-big-men,Golden State did discuss the pursuit of Domantas Sabonis before the 2022 trade deadline
2025-11-26,Anthony Davis,,marcstein.substack.com,"There is an expectation in some corners, you see, that Anthony Davis and his representation at Klutch Sports will seek a contract extension from a new team if he indeed gets dealt . marcstein.substack.com Dallas Mavericks , Trade , Anthony Davis",https://marcstein.substack.com/p/talking-zone-defense-nba-big-men,"There is an expectation in some corners, you see, that Anthony Davis and his representation at Klutch Sports will seek a contract extension from a new team if he indeed gets dealt"
2025-11-26,Anthony Davis,,dallasnews.com,"“It was surprising more than anything,” Davis said. “Nico’s my guy. Obviously, he played a huge part of getting me here and wanting me to fulfill his vision, in a sense, that he saw. It was definitely tough. ... It’s the business of basketball. Once I had those conversations [with Harrison and Dumont], I was able to move forward and continue to rehab and get back on the floor and try to compete.” Dallas Morning News Dallas Mavericks , Trade , Anthony Davis , Nico Harrison , Patrick Dumont",https://www.dallasnews.com/sports/mavericks/2025/11/26/anthony-davis-trade-mavericks-dallas-nba-injury-nico-harrison/,"It’s the business of basketball. Once I had those conversations [with Harrison and Dumont], I was able to move forward and continue to rehab and get back on the floor and try to compete.”"
2025-11-26,Anthony Davis,,x.com,"Mike Curtis: Anthony Davis was asked about his name being involved in trade rumors: “Man, look. Y'all make it like we’re going to war or something. This is basketball. It comes with it…That doesn’t affect me. I’ve been in trade talks for a while. My job is to do what I do when I’m on the floor, play basketball and try to lead this team. Whatever comes out of that, comes out of that.” x.com Dallas Mavericks , Trade , Anthony Davis",https://x.com/MikeACurtis2/status/1993773663066157216,"it…That doesn’t affect me. I’ve been in trade talks for a while. My job is to do what I do when I’m on the floor, play basketball and try to lead this team."
2025-11-24,Anthony Davis,,bleacherreport.com,"The Dallas Mavericks are reportedly facing a conundrum when it comes to potentially trading star big man Anthony Davis. During Monday's episode of The Hoop Collective, ESPN's Tim Bontemps explained that Davis' trade value isn't as high as many would expect for a player of his caliber. ""The idea of trading Anthony Davis has everyone trained to think, well, they're gonna get three firsts, two swaps, they're gonna get two young players and they're gonna get all this stuff,"" Bontemps said around the 33:00 mark. ""I shouldn't say it's not gonna happen... but, you talk to people in the league, there's not a lot of teams that are lining up to take on a 35-year-old Anthony Davis making $63 million, and you have to assume that he's gonna opt into that deal."" Bleacher Report Dallas Mavericks , Trade , Anthony Davis",https://bleacherreport.com/articles/25304382-what-anthony-davis-trade-value-nba-insiders-shocking-revelation-amid-mavs-rumors,"""I shouldn't say it's not gonna happen... but, you talk to people in the league, there's not a lot of teams that are lining up to take on a 35-year-old Anthony Davis making $63 million, and you have to assume that he's gonna opt into that deal."""
2025-11-24,Jonathan Kuminga,,nytimes.com,"DeMar DeRozan, the 36-year-old who league sources say has some interest from the LA Clippers, has a partial guarantee on his deal for next season (approximately $10 million of his $25.7 million). Malik Monk, who was part of the Jonathan Kuminga trade talks with Golden State in the summer that are likely to be revisited, has a combined $41.7 million on his deal in the next two seasons (including a 2027-28 player option). The list goes on from there, with fourth-year guard Keon Ellis ($2.3 million expiring deal) widely seen as one of the most coveted Kings players among rival teams. New York Times Los Angeles Clippers , Sacramento Kings , Trade , DeMar DeRozan",https://www.nytimes.com/athletic/6832410/2025/11/24/scott-perry-sacramento-kings-building-future/,"DeMar DeRozan, the 36-year-old who league sources say has some interest from the LA Clippers,"
2025-11-24,LaMelo Ball,,youtube.com,"Marc Stein: “What I think is really happening here, in the grand scheme — and I already mentioned Ja Morant in Memphis — is that Trae Young is now in a similar position. He’s out in Atlanta, and the Hawks have been winning some games without him. Remember, this summer the two sides could have engaged in contract extension talks, but they didn’t. The Hawks made it clear to Trae Young’s camp that they weren’t interested in an extension before the season. They wanted this season to play out. Around the league, these three guards — LaMelo Ball, Ja Morant, and Trae Young — are being grouped together in the eyes of a lot of executives. Maybe they aren’t available right now, as we speak but these are players teams are anticipating could be available between now and the trade deadline on February 5th. And again, all three of these guys have been All-Stars . YouTube Atlanta Hawks , Charlotte Hornets , Memphis Grizzlies , Trade , LaMelo Ball , Trae Young , Ja Morant",https://www.youtube.com/live/FLwniS558nA,"Around the league, these three guards — LaMelo Ball, Ja Morant, and Trae Young — are being grouped together in the eyes of a lot of executives. Maybe they aren’t available right now, as we speak but these are players teams are anticipating could be available between now and the trade deadline on February 5th. And again, all three of these guys have been All-Stars"
2025-11-24,Lamelo Ball,,youtube.com,"Marc Stein: The reality is, there’s chatter out there — a lot of curiosity, most of it coming from rival front offices. Are the Hornets going to be open to fielding trade pitches for LaMelo Ball? To this point — and this will sound a lot like the Ja Morant situation in Memphis — the messaging is that the Hornets don’t want to field those pitches. They don’t want to trade him . There was a report this week from my pal in Houston, Kelly Iko, writing for Yahoo Sports. Kelly wrote that Ball is open to a trade, and that the Hornets are disillusioned with him on various levels. Both parties have come out and publicly denied that — insisting it’s not the case. Again, we haven’t even gotten to Thanksgiving. Trade season doesn’t officially start until December 15th. As of where we are right now, the Hornets insist they’re not gauging Ball’s trade value.” YouTube Charlotte Hornets , Trade , LaMelo Ball",https://www.youtube.com/live/FLwniS558nA,To this point — and this will sound a lot like the Ja Morant situation in Memphis — the messaging is that the Hornets don’t want to field those pitches. They don’t want to trade him
2025-11-23,Lamelo Ball,,marcstein.substack.com,"LaMelo Ball is not a character concern off the floor by any means, to my understanding, even if sources say it's indeed true that he's been frustrated by the team's lack of forward progress. Ball has played in 47 or fewer games in each of the past three seasons due to injury. His shot selection also turns some teams off, but the durability questions resonate the loudest leaguewide. It's somewhat reminiscent of the situation Anthony Davis faces in Dallas. The Hornets are unlikely to get the sort of offers for Ball they'd be hoping for until their star guard can get through a stretch of sustained production, availability and ideally some winning. No wonder the Hornets, as league sources maintain, are not currently interested in looking to move him. marcstein.substack.com Charlotte Hornets , Trade , LaMelo Ball",https://marcstein.substack.com/p/sunday-best-the-pieces-of-this-seasons,"LaMelo Ball is not a character concern off the floor by any means, to my understanding, even if sources say it's indeed true that he's been frustrated by the team's lack of forward progress."
2025-11-23,Keon Ellis,,marcstein.substack.com,"The King who appears to hold the most immediate trade value: Keon Ellis. ""More than half the league has called on him,"" one source with knowledge of the situation told The Stein Line . marcstein.substack.com Sacramento Kings , Trade , Keon Ellis",https://marcstein.substack.com/p/sunday-best-the-pieces-of-this-seasons,"""More than half the league has called on him,"" one source with knowledge of the situation told The Stein Line"
2025-11-23,Keegan Murray,,marcstein.substack.com,"Just don't get your hopes up about your favorite team acquiring the recently re-signed Keegan Murray. … or last June's prized first-round pick Nique Clifford. Sources say both will be off the table in upcoming trade talks . marcstein.substack.com Sacramento Kings , Trade , Keegan Murray",https://marcstein.substack.com/p/sunday-best-the-pieces-of-this-seasons,Clifford. Sources say both will be off the table in upcoming trade talks
2025-11-23,Domantas Sabonis,,marcstein.substack.com,"Maybe this was inevitable after a 41-point loss to the Morant-less Grizzlies, but league sources say that the Kings are willing to listen to offers for players up and down their roster … particularly for Sacramento's veterans . marcstein.substack.com Sacramento Kings , Trade , Domantas Sabonis",https://marcstein.substack.com/p/sunday-best-the-pieces-of-this-seasons,league sources say that the Kings are willing to listen to offers for players up and down their roster … particularly for Sacramento's veterans
2025-11-23,Anthony Davis,,sny.tv,"Ian Begley: I’d guess today that they prioritize point guard over front court in the trade market. This is stating the obvious, but I’m sure the Knicks would at least check in with Dallas if/when Anthony Davis becomes available. You may scoff at the idea, but the Knicks want to win a title this season. If Dallas is offering Davis at a below-market cost, I’m sure the Knicks will at least give the move some thought. But this, again, is stating the obvious. The Mavs will get calls from nearly all NBA teams if/when they make Davis available. SportsNet New York Dallas Mavericks , New York Knicks , Trade , Anthony Davis",https://sny.tv/articles/knicks-mailbag-11-22-25,I’m sure the Knicks would at least check in with Dallas if/when Anthony Davis becomes available.
2025-11-22,PLAYER,,hoopshype.com,"What actually goes into determining a player’s trade value? Talent is first and foremost, obviously, but there's also the length and worth of the player's contract, their age, their fit with the roster, their attitude towards the game, their injury history, their lifestyle off the court, and much more. That's all to say… It's actually pretty hard to measure a player's trade value. Since there is no measurable way to establish it, we decided: Why not leave it up for the people - you guys - to decide? And that's what we're doing here exactly, leaving you with the option to pick between players to determine who you'd rather have, i.e., who has the better trade value . HoopsHype Trade , NBA , Stats",https://www.hoopshype.com/story/sports/nba/2025/11/21/nba-trade-value-rankings-who-are-the-leagues-most-coveted-players/87296025007/,"Why not leave it up for the people - you guys - to decide? And that's what we're doing here exactly, leaving you with the option to pick between players to determine who you'd rather have, i.e., who has the better trade value"
2025-11-22,Lamelo Ball,,marcstein.substack.com,"Jake Fischer: Another one we’ll touch on more tomorrow. LaMelo Ball does not want out of Charlotte, to my understanding. I believe that to be true. The Hornets have definitely given other teams the impression they will listen to offers for him, though . marcstein.substack.com Charlotte Hornets , Trade , LaMelo Ball",https://marcstein.substack.com/,"The Hornets have definitely given other teams the impression they will listen to offers for him, though"
2025-11-21,Terry Rozier,,sun-sentinel.com,"According to multiple NBA sources, the Heat have yet to receive clarity from the league about whether Rozier’s salary can be utilized to balance a potential trade for salary-cap purposes . Contacted by the South Florida Sun Sentinel, the NBA declined to say whether the Heat are banned from including Rozier’s salary in a trade, with the Heat yet to receive any clarity from the league, according to a source. South Florida Sun-Sentinel Miami Heat , Trade , Terry Rozier",https://www.sun-sentinel.com/2025/11/21/heat-still-without-nba-clarity-regarding-whether-they-can-include-roziers-salary-in-a-trade/,"According to multiple NBA sources, the Heat have yet to receive clarity from the league about whether Rozier’s salary can be utilized to balance a potential trade for salary-cap purposes"
2025-11-21,Lamelo Ball,,charlotteobserver.com,"LaMelo Ball dismissed a Yahoo! report that emerged Thursday indicating Ball is unhappy with the Hornets and open to being traded elsewhere. “It didn’t come from me,” Ball said. “The source wasn’t me, so it’s false info. Got to let them know. I really don’t like commenting on stuff, but it got too big.” He added: “I love being here.” Charlotte Observer Charlotte Hornets , Trade , LaMelo Ball",https://www.charlotteobserver.com/sports/charlotte-hornets/article312743904.html,"LaMelo Ball dismissed a Yahoo! report that emerged Thursday indicating Ball is unhappy with the Hornets and open to being traded elsewhere. “It didn’t come from me,” Ball said. “The source wasn’t me, so it’s false info."
2025-11-21,Lamelo Ball,,charlotteobserver.com,"Ball, as he mentioned, typically doesn’t give those kinds of stories a second thought. But this time, he decided to go a different route. Why? “It was (spreading) so much, they were making headlines,” Ball said. “Bleacher Report and this and that. So I didn’t want it to keep going on.” Charlotte Observer Charlotte Hornets , Trade , LaMelo Ball",https://www.charlotteobserver.com/sports/charlotte-hornets/article312743904.html,"Ball, as he mentioned, typically doesn’t give those kinds of stories a second thought. But this time, he decided to go a different route. Why? “It was (spreading) so much, they were making headlines,” Ball said."
