date,player,team,source,snippet,url,title
2025-11-21,Lamelo Ball,,charlotteobserver.com,"Those words were music to the ears of the Hornets’ second-year coach. “I’m glad to hear what he had to say because I would echo a lot of same things,” Charles Lee said. “Our relationship, our ability to have communication between myself, Melo and Jeff (Peterson, the team’s president of basketball operations), it’s really hot. And I think that he’s always communicated to us. “He wants to build this thing with us. He understands what it’s going to take to try to win and who we need in the building and stuff. So I think that he is just committed to Charlotte. He’s talked about how much he loves the city and the fans and that’s all I ever hear and that’s all.” Charlotte Observer Charlotte Hornets , Trade , Coaching , Charles Lee , Jeff Peterson , LaMelo Ball",https://www.charlotteobserver.com/sports/charlotte-hornets/article312743904.html,"“I’m glad to hear what he had to say because I would echo a lot of same things,” Charles Lee said. “Our relationship, our ability to have communication between myself, Melo and Jeff (Peterson, the team’s president of basketball operations), it’s really hot."
2025-11-21,Ja Morant,,espn.com,"Given Morant hasn't improved as a shooter -- he was an abysmal 10-for-60 from 3 before his latest calf injury -- it's easy to see why he's not the same player who electrified the league and appeared to have Memphis on a championship-caliber trajectory a few short years ago. Sources expect Memphis to explore the trade market for Morant but, like Davis, believe it will be difficult to get value for him. ‘I do think they'll move him,’ a West scout said . ESPN Memphis Grizzlies , Trade , Ja Morant",https://www.espn.com/nba/story/_/id/47039949/nba-first-month-lessons-intel-thunder-lakers-warriors-knicks-every-team,"Sources expect Memphis to explore the trade market for Morant but, like Davis, believe it will be difficult to get value for him. ‘I do think they'll move him,’ a West scout said"
2025-11-21,Josh Giddey,,espn.com,"The Bulls could go in a few directions over the next several months, including adding to the current roster. That has led some sources to speculate whether Chicago, with over $80 million in expiring money, could be a suitor for Dallas' Anthony Davis and bring the Windy City native home. ‘I could see it,’ a West executive, who recently saw Chicago play, said. ‘[Josh] Giddey has worked well with Vucevic, but he could use a roll man to throw it up to . ESPN Chicago Bulls , Dallas Mavericks , Trade , Nikola Vucevic , Anthony Davis , Josh Giddey",https://www.espn.com/nba/story/_/id/47039949/nba-first-month-lessons-intel-thunder-lakers-warriors-knicks-every-team,"That has led some sources to speculate whether Chicago, with over $80 million in expiring money, could be a suitor for Dallas' Anthony Davis and bring the Windy City native home. ‘I could see it,’ a West executive, who recently saw Chicago play, said. ‘[Josh] Giddey has worked well with Vucevic, but he could use a roll man to throw it up to"
2025-11-20,Lamelo Ball,,sports.yahoo.com,"Following the Hornets’ disappointing road loss to the 2-13 Indiana Pacers — their fourth straight, dropping Charlotte to 12th in the Eastern Conference with a 4-11 record — star guard LaMelo Ball has grown increasingly frustrated with the organization and is open to a trade away from the franchise, multiple league sources told Yahoo Sports . Yahoo! Sports Charlotte Hornets , Trade , LaMelo Ball",https://sports.yahoo.com/nba/article/sources-lamelo-ball-open-to-trade-away-from-hornets-215320940.html,"star guard LaMelo Ball has grown increasingly frustrated with the organization and is open to a trade away from the franchise, multiple league sources told Yahoo Sports"
2025-11-20,Lamelo Ball,,sports.yahoo.com,"League sources say the front office is increasingly hesitant about cementing Ball as a long-term foundational piece, has become disillusioned with the 24-year-old and is open to moving him . Yahoo! Sports Charlotte Hornets , Trade , LaMelo Ball",https://sports.yahoo.com/nba/article/sources-lamelo-ball-open-to-trade-away-from-hornets-215320940.html,"League sources say the front office is increasingly hesitant about cementing Ball as a long-term foundational piece, has become disillusioned with the 24-year-old and is open to moving him"
2025-11-20,Lamelo Ball,,x.com,"LaMelo Ball: ? x.com Charlotte Hornets , Trade , LaMelo Ball",https://x.com/MELOD1P/status/1991644767235764597,Ball: ?
2025-11-20,Anthony Davis,,marcstein.substack.com,"League sources say that the Mavericks still intend to field any trade interest in Davis that emerges over the next two-plus months ... with the prospect of an actual trade obviously dependent on offer quality . marcstein.substack.com Dallas Mavericks , Trade , Anthony Davis",https://marcstein.substack.com/p/is-the-nbas-trade-market-for-point,League sources say that the Mavericks still intend to field any trade interest in Davis that emerges over the next two-plus months ... with the prospect of an actual trade obviously dependent on offer quality
2025-11-20,Jonathan Kuminga,,marcstein.substack.com,"He's not even eligible to be moved until Jan. 15, but it's no secret that the Warriors' hardball stance all summer with Kuminga in the sides' restricted free agency saga was adopted with the intention to ensure that the 23-year-old was re-signed to a tradeable contract. ""It’s one of the best trade chips in the league,"" one veteran executive told The Stein Line . marcstein.substack.com Golden State Warriors , Free Agency , Trade , Jonathan Kuminga",https://marcstein.substack.com/p/is-the-nbas-trade-market-for-point,"""It’s one of the best trade chips in the league,"" one veteran executive told The Stein Line"
2025-11-19,Anthony Davis,,x.com,"Shams Charania: This franchise is moving away from Nico Harrison's three to four year championship window, and toward trying to find sustained success and sustained growth around Cooper, Flagg and youth. And to that end, sources have told ESPN that the Mavericks will be listening to trade calls for Anthony Davis and seeing and exploring his value. And for that, health will be the biggest key because not only for the Mavericks to evaluate Anthony Davis over a lengthy period of time, an extended period of time on the court, but for other teams that could have interest in him to see what he looks like when he's back with this team, looks like when he's back, a lot of evaluation to come around . x.com Dallas Mavericks , Trade , Anthony Davis , Nico Harrison",https://x.com/ShamsCharania/status/1991301604952404406,"And for that, health will be the biggest key because not only for the Mavericks to evaluate Anthony Davis over a lengthy period of time, an extended period of time on the court, but for other teams that could have interest in him to see what he looks like when he's back with this team, looks like when he's back, a lot of evaluation to come around"
2025-11-19,Anthony Davis,,nytimes.com,"Dallas Mavericks minority owner Mark Cuban told The Athletic the franchise would not try to trade Anthony Davis this season. “We won’t. We want to try to win,” Cuban said Wednesday in an email when asked if he and Mavericks governor Patrick Dumont would seek a deal for Davis, the oft-injured, 10-time All-Star who was the centerpiece for Dallas in last season’s Luka Dončić trade . New York Times Dallas Mavericks , Trade , Mark Cuban , Anthony Davis , Patrick Dumont",https://www.nytimes.com/athletic/6820984/2025/11/19/mavericks-anthony-davis-trade-mark-cuban/?source=emp_shared_article,"“We won’t. We want to try to win,” Cuban said Wednesday in an email when asked if he and Mavericks governor Patrick Dumont would seek a deal for Davis, the oft-injured, 10-time All-Star who was the centerpiece for Dallas in last season’s Luka Dončić trade"
2025-11-19,Anthony Davis,,espn.com,"Multiple team sources said the Mavs, who are 4-11 and outside the playoff picture in the West, will also explore the trade market for Anthony Davis, the 10-time All-Star big man who was the headliner in the return of the Doncic deal, as part of that process before this season's deadline. For a fan base that still feels betrayed, so many questions linger in the wake of this self-inflicted saga, many of which center around the famous former majority owner. ESPN Dallas Mavericks , Trade , Anthony Davis",https://www.espn.com/nba/story/_/id/47014061/inside-mavericks-power-struggle-nico-harrison-vs-mark-cuban,"Multiple team sources said the Mavs, who are 4-11 and outside the playoff picture in the West, will also explore the trade market for Anthony Davis,"
2025-11-18,Ja Morant,,fansided.com,"Memphis is not willing to consider Ja Morant trades unless it’s a no-brainer (which no one is calling with), according to sources. They want to make this work. Morant may have to force the issue if there is to be a trade. FanSided Memphis Grizzlies , Trade , Ja Morant",https://fansided.com/nba/nba-insider-trade-rumors-anthony-davis-ja-morant,Memphis is not willing to consider Ja Morant trades unless it’s a no-brainer
2025-11-18,Keon Ellis,,fansided.com,"The one player every executive is keeping an eye on is Keon Ellis. That’s a value contract for a great perimeter defender with some shooting chops. FanSided Sacramento Kings , Trade , Keon Ellis",https://fansided.com/nba/nba-insider-trade-rumors-anthony-davis-ja-morant,The one player every executive is keeping an eye on is Keon Ellis.
2025-11-18,Keegan Murray,,fansided.com,"Keegan Murray is not eligible to be traded after his extension this fall, but even if he were, league sources have adamantly said he’s off limits . FanSided Sacramento Kings , Trade , Keegan Murray",https://fansided.com/nba/nba-insider-trade-rumors-anthony-davis-ja-morant,"Keegan Murray is not eligible to be traded after his extension this fall, but even if he were, league sources have adamantly said he’s off limits"
2025-11-18,Lauri Markkanen,,fansided.com,"Utah continues to stonewall all talks for Lauri Markkanen. If they move him, it will be sudden . FanSided Utah Jazz , Trade , Lauri Markkanen",https://fansided.com/nba/nba-insider-trade-rumors-anthony-davis-ja-morant,Utah continues to stonewall all talks for Lauri Markkanen.
2025-11-18,Kevin Love,,x.com,"Dave McMenamin: “We need him.” Utah Jazz coach Will Hardy gives an impassioned 2 1/2 minute answer about the importance of Kevin Love with his team after the 18-year veteran landed in Utah after an unexpected trade from Miami in the offseason. x.com Miami Heat , Utah Jazz , Trade , Kevin Love , Will Hardy",https://x.com/mcten/status/1990966027216433244,“We need him.”
2025-11-18,Anthony Davis,,espn.com,"In Los Angeles, Davis played the most games in his career (76) during the 2023-24 season and was named to the All-NBA and All-Defensive teams. That was the first time Davis played at least 65 games since 2017-18. He was averaging 25.7 points and 11.9 rebounds in 41 games before he was traded to Dallas. Davis has played 15 games since, missing time because of a left abductor strain and currently a left calf strain. ""While you can point to Davis as a top-20 player in Los Angeles, it is a $175 million gamble and perhaps more, if you trade for him,"" a West executive said. ""I would want to see a long stretch of games of Davis healthy before there could ever be a discussion."" ESPN Dallas Mavericks , Trade , Anthony Davis",https://www.espn.com/nba/story/_/id/46993870/mavericks-options-trade-anthony-davis-wait-free-agency-tank-draft,"""While you can point to Davis as a top-20 player in Los Angeles, it is a $175 million gamble and perhaps more, if you trade for him,"" a West executive said. ""I would want to see a long stretch of games of Davis healthy before there could ever be a discussion."""
2025-11-18,Anthony Davis,,espn.com,"ESPN talked to team executives from both conferences regarding Davis' future and what his market could look like if the Mavericks explore trading him. ""You have to look at what he did the prior two seasons with the Lakers, his short tenure in Dallas and then the future,"" an Eastern Conference executive said . ESPN Dallas Mavericks , Trade , Anthony Davis",https://www.espn.com/nba/story/_/id/46993870/mavericks-options-trade-anthony-davis-wait-free-agency-tank-draft,"""You have to look at what he did the prior two seasons with the Lakers, his short tenure in Dallas and then the future,"" an Eastern Conference executive said"
2025-11-18,Ja Morant,,youtube.com,"Zach Lowe: ""I will say with Ja — teams that are watching him, and I talked to one of them over the weekend — they’re throwing his current level of play into the trash. They’re saying, 'This looks to us like a guy who wants out.' And they’re going to judge him more by his long-term track record — whatever that even is at this point, given his games played issues over the last few years — than by what they’re seeing right now."" ""But, I mean… he’s averaging 18 a game, shooting 36% from the field, 17% from three, and just looks disengaged for half of every game on both ends of the floor."" YouTube Memphis Grizzlies , Trade , Ja Morant",https://www.youtube.com/watch?v=dQJHT3yr5JM,"They’re saying, 'This looks to us like a guy who wants out.' And they’re going to judge him more by his long-term track record — whatever that even is at this point,"
2025-11-18,Kevin Love,,youtube.com,"Isaiah Thomas: It was obviously a tough situation. I felt like I gave my heart to this city, to this organization. To be a franchise player and then get traded out of nowhere — especially while I was hurt — that hit hard. But out of all people, I understood the business. People would always say, ‘Ah, you keep bringing it up,’ but it was the media bringing it up. I wasn’t talking about it — I just had to answer the questions. At the end of the day, I’m human. I had real feelings. I had real love for this city and the organization. I wanted to keep it going . But like I said, I understand the business 100%. Sometimes things happen that neither side really wants, but for business reasons, it makes sense. So, you find ways to grow, to move on, and to keep competing — with a smile on your face. YouTube Boston Celtics , Trade , Isaiah Thomas",https://www.youtube.com/watch?v=3Ij9Kx7E4Rs,"At the end of the day, I’m human. I had real feelings. I had real love for this city and the organization. I wanted to keep it going"
2025-11-17,Anthony Davis,,espn.com,"ESPN talked to team executives from both conferences regarding Davis' future and what his market could look like if the Mavericks explore trading him. ""You have to look at what he did the prior two seasons with the Lakers, his short tenure in Dallas and then the future,"" an Eastern Conference executive said . In Los Angeles, Davis played the most games in his career (76) during the 2023-24 season and was named to the All-NBA and All-Defensive teams. That was the first time Davis played at least 65 games since 2017-18. He was averaging 25.7 points and 11.9 rebounds in 41 games before he was traded to Dallas. ESPN Dallas Mavericks , Trade , Anthony Davis",https://www.espn.com/nba/story/_/id/46993870/mavericks-options-trade-anthony-davis-wait-free-agency-tank-draft,"ESPN talked to team executives from both conferences regarding Davis' future and what his market could look like if the Mavericks explore trading him. ""You have to look at what he did the prior two seasons with the Lakers, his short tenure in Dallas and then the future,"" an Eastern Conference executive said"
2025-11-17,Anthony Davis,,espn.com,"Davis has played 15 games since, missing time because of a left abductor strain and currently a left calf strain. ""While you can point to Davis as a top-20 player in Los Angeles, it is a $175 million gamble and perhaps more, if you trade for him,"" a West executive said. ""I would want to see a long stretch of games of Davis healthy before there could ever be a discussion."" ESPN Dallas Mavericks , Trade , Anthony Davis",https://www.espn.com/nba/story/_/id/46993870/mavericks-options-trade-anthony-davis-wait-free-agency-tank-draft,"""While you can point to Davis as a top-20 player in Los Angeles, it is a $175 million gamble and perhaps more, if you trade for him,"" a West executive said."
2025-11-17,nan,,youtube.com,"Carlos Delfino: ""When I got injured, I was still on Milwaukee’s roster of 15, but then they cut me and traded me to the Clippers. That contract became the first one in league history to be handled using the Stretch Provision. After that, bye. Yes, the Clippers contract was respected. First of the month and day 15 I earned a check, but never again. Those things happened a long time ago YouTube Los Angeles Clippers , Milwaukee Bucks , Trade , Carlos Delfino",https://www.youtube.com/watch?v=waSdfTnodvA&t=3298s,"Carlos Delfino: ""When I got injured, I was still on Milwaukee’s roster of 15, but then they cut me and traded me to the Clippers. That contract became the first one in league history to be handled using the Stretch Provision."
2025-11-16,Daniel Gafford,,marcstein.substack.com,"Daniel Gafford is widely regarded as the most tradeable Maverick between now and the Feb. 5 trade deadline in Year 1 of a three-year deal worth $54.4 million, but the injuries that have frequently derailed Davis and Dereck Lively II add a layer of complication even to Gafford's status . marcstein.substack.com Dallas Mavericks , Trade , Daniel Gafford , Dereck Lively",https://marcstein.substack.com/p/sunday-best-the-pelicans-mavericks,"Daniel Gafford is widely regarded as the most tradeable Maverick between now and the Feb. 5 trade deadline in Year 1 of a three-year deal worth $54.4 million, but the injuries that have frequently derailed Davis and Dereck Lively II add a layer of complication even to Gafford's status"
2025-11-14,Domantas Sabonis,,youtube.com,"Sam Amick: “The reason they were comfortable doing the Keegan Murray contract is because — partly at least — they not only valued him within their program, but they learned that he’s got a lot of value around the league. So, as it relates to Sabonis, my understanding is there are at least a few teams that have raised their hand to say, ‘Yeah, he’s somebody we’d want to talk about.’ I’ve said it on your show before — I don’t have that sort of information about Zach [LaVine].” YouTube Sacramento Kings , Trade , Domantas Sabonis",https://www.youtube.com/watch?v=aLfHxlLUKdA,"as it relates to Sabonis, my understanding is there are at least a few teams that have raised their hand to say, ‘Yeah, he’s somebody we’d want to talk about.’"
2025-11-14,Anthony Davis,,sports.yahoo.com,"Wall, who played alongside Davis during their college days at Kentucky, further fueled speculation by linking him to his hometown team. “You can’t believe everything you hear on the news, but you be hearing that he wants to go back to Chicago and see what’s going on,” Wall continued. “So, I think they’re trying to blow it up and build around Cooper Flagg and get rid of some of the other pieces, but they are one of those dark horse teams if they can stay healthy — keep AD there and let Kyrie come back. I feel like they could’ve been a team in the West, but I think with Nico Harrison’s firing they might end up going in a different direction.” Yahoo! Sports Chicago Bulls , Dallas Mavericks , Trade , John Wall , Anthony Davis , Podcast",https://sports.yahoo.com/article/nba-rumors-john-wall-claims-174816057.html,"“You can’t believe everything you hear on the news, but you be hearing that he wants to go back to Chicago and see what’s going on,” Wall continued."
2025-11-14,Anthony Davis,,youtube.com,"Tim MacMahon: And I think they will have discussions, at least internally, about exploring the trade market for Anthony Davis. He’s got to get back on the floor. They need to make sure he’s not in a situation where he could aggravate the calf injury—or worse . He will have some type of trade value, and they’ve got to explore that. As for Kyrie Irving—it might be mutually beneficial for him just to take the whole year, focus on getting 100% healthy, and not help them win a few more games down the stretch. YouTube Dallas Mavericks , Trade , Kyrie Irving , Anthony Davis",https://www.youtube.com/watch?v=bHfb54Q_jzI,"I think they will have discussions, at least internally, about exploring the trade market for Anthony Davis. He’s got to get back on the floor. They need to make sure he’s not in a situation where he could aggravate the calf injury—or worse"
2025-11-14,Anthony Davis,,espn.com,"But no, the discussions were whether the Mavs could get appropriate value when trading Davis. ""I just looked it up so I could say this to my owner if he asks me about it, AD is turning 33 in March and he's going to be in position next summer where he'll probably want a contract extension that would cost $70 million per year when he'd be 37,"" one general manager said . ""He's a great player, full stop. But when you consider a player at his age with his injury history, you'd also be trading for the stress of that extension. That plays into it."" ESPN Dallas Mavericks , Trade , Anthony Davis",https://www.espn.com/nba/story/_/id/46957985/nba-intel-execs-scouts-sinking-mavs-lebron-lakers-spurs,"""I just looked it up so I could say this to my owner if he asks me about it, AD is turning 33 in March and he's going to be in position next summer where he'll probably want a contract extension that would cost $70 million per year when he'd be 37,"" one general manager said"
2025-11-14,Anthony Davis,,espn.com,"With the Mavericks being the biggest topic around the league this week, the discussion quickly shifted to the question looming over whomever is tapped to replace Harrison as the lead executive: What does the future hold for Davis and Irving less than three months until the February trade deadline? The belief, from sources I spoke to, is that the Mavs moving on from at least Davis, if not both stars, was the optimal strategy. Those moves would help maximize the 2026 first-round pick in a loaded 2026 draft class -- the only selection Dallas controls the rest of this decade -- to reposition the franchise around 2025 No. 1 pick Cooper Flagg . ""Absolutely,"" an Eastern Conference executive said when asked whether trading the two veteran stars was the right path for Dallas. ESPN Dallas Mavericks , Trade , Kyrie Irving , Anthony Davis",https://www.espn.com/nba/story/_/id/46957985/nba-intel-execs-scouts-sinking-mavs-lebron-lakers-spurs,"The belief, from sources I spoke to, is that the Mavs moving on from at least Davis, if not both stars, was the optimal strategy. Those moves would help maximize the 2026 first-round pick in a loaded 2026 draft class -- the only selection Dallas controls the rest of this decade -- to reposition the franchise around 2025 No. 1 pick Cooper Flagg"
2025-11-13,Anthony Davis,,x.com,"Run It Back: John Wall believes Anthony Davis is done with Dallas and wants to see AD traded ? ""You been hearing he wants to go back to Chicago and see what's going on."" x.com Chicago Bulls , Dallas Mavericks , Trade , John Wall , Anthony Davis",https://x.com/RunItBackFDTV/status/1988993042569675134?s=20,John Wall believes Anthony Davis is done with Dallas and wants to see AD traded ?
2025-11-13,Ja Morant,,youtube.com,"Brian Windhorst: I have not heard that Ja Morant is available. I don’t know everything—I wouldn’t say I know everything that’s going on—but I have not heard he’s available . Have there been discussions that, I have all day, every day—about transactions, about “Is it something people are thinking about? Could it happen? What would the market look like?” I have heard that. I will just tell you: Ja is having a terrible season. His shooting numbers and his production have fallen off a cliff. Now, that seems to be because he's not happy with his situation, but he’s already coming off several years in a row where he’s had either major off-court problems or injuries. YouTube Memphis Grizzlies , Trade , Ja Morant",https://www.youtube.com/watch?v=oH6UB9gq46o,I have not heard that Ja Morant is available. I don’t know everything—I wouldn’t say I know everything that’s going on—but I have not heard he’s available
