date,player,team,source,snippet,url,title
2025-11-13,Luka Doncic,,lakersnation.com,"After the trade, Harrison and the Mavericks leaked some reports about Doncic and his poor conditioning being the reason they decided to trade him. Luka has remained classy throughout a difficult situation for him though and that was again the case after Wednesday night’s loss to the Oklahoma City Thunder when he was asked about Harrison’s firing, via Spectrum SportsNet: “Look, I mean, the city of Dallas, fans, players, they’re all have a special place in my heart. I thought I was gonna stay there forever. But I didn’t. So they’ll always be a special place for me, always I can call it home. But right now, I’m focused on the Lakers, trying to move on. But obviously, always gonna be part of me in there. Just trying to move on and focus on what we’re doing.” Doncic was then asked if he can see himself returning to the Mavericks sometime down the road but maintained that his focus is on his current team: “Right now I’m just focused on the Lakers. No further comments.” Lakers Nation Dallas Mavericks , Los Angeles Lakers , Oklahoma City Thunder , Trade",https://lakersnation.com/luka-doncic-focused-on-lakers-when-asked-about-potential-return-mavericks-after-nico-harrison-firing/,Doncic was then asked if he can see himself returning to the Mavericks sometime down the road but maintained that his focus is on his current team: “Right now I’m just focused on the Lakers. No further comments.”
2025-11-13,Ja Morant,,youtube.com,"Brian Windhorst: Let's say there's seven or eight. Let's say there's seven or eight teams. You could debate whether there's six, whether there's nine. Let's just say there's seven or eight teams that would, you know, consider upgrading their point guard position. How many of those teams want Ja Morant that like that in that like those indicators? It's not seven or eight, Rich. We could spend another couple hours debating it, but you know, let's say it's a few. Okay, let's let's say it's three or four. All right, I'll give you five. I don't think it's five, but let's just say it's five. How many of those five teams have a trade package that's available to—that Memphis would like? And I want to remind you, there's a whole bunch of teams out there that have restrictions on trades because of first or second apron stuff. So, all of a sudden, the needle eye gets really narrow . And so, you have a conversation about whether Ja Morant can be traded. And you know, a lot of people would say, ‘Oh, yes, of course.’ You know, and I say, ‘I don't know about that. I'm not sure that there's a massive market out there.’” YouTube Memphis Grizzlies , Trade , Ja Morant",https://www.youtube.com/watch?v=oH6UB9gq46o,"How many of those five teams have a trade package that's available to—that Memphis would like? And I want to remind you, there's a whole bunch of teams out there that have restrictions on trades because of first or second apron stuff. So, all of a sudden, the needle eye gets really narrow"
2025-11-13,Ja Morant,,bleacherreport.com,"Memphis Grizzlies star Ja Morant was seemingly unimpressed with a fan's attempt to recruit him to the New York Knicks. A video posted Tuesday night to TikTok showed a fan asking Morant to come to New York as he walked into the tunnel at Madison Square Garden. ""I'm cool,"" Morant responded . Bleacher Report Memphis Grizzlies , New York Knicks , Trade , Ja Morant",https://bleacherreport.com/articles/25291818-ja-morant-responds-knicks-fan-recruiting-him-video-amid-nba-trade-rumors,"A video posted Tuesday night to TikTok showed a fan asking Morant to come to New York as he walked into the tunnel at Madison Square Garden. ""I'm cool,"" Morant responded"
2025-11-12,Anthony Davis,,marcstein.substack.com,"It's believed the Mavericks will work with Davis' camp over the next two-plus months as they decide whether to pursue an in-season trade. Davis' agent Rich Paul and Mavericks owner Patrick Dumont have established a relationship that features regular contact since they were introduced at the Mavericks' Play-In Tournament victory in Sacramento in April. The parties are thus expected to work in concert to some degree on next steps. marcstein.substack.com Dallas Mavericks , Trade , Anthony Davis , Rich Paul , Patrick Dumont",https://marcstein.substack.com/p/whats-next-after-the-firing-of-nico,It's believed the Mavericks will work with Davis' camp over the next two-plus months as they decide whether to pursue an in-season trade.
2025-11-12,Anthony Davis,,x.com,"Marc Stein: As for what Nico Harrison's dismissal means for Anthony Davis' future in Dallas: Sources tell @TheSteinLine and @DLLS_Sports that Davis' agent Rich Paul has established a strong relationship with Mavericks owner Patrick Dumont since February's trade. They are in regular contact . x.com Dallas Mavericks , Trade , Anthony Davis , Rich Paul , Nico Harrison , Patrick Dumont",https://x.com/TheSteinLine/status/1988272100746969465?ref_src=twsrc%5Etfw%7Ctwcamp%5Etweetembed%7Ctwterm%5E1988272100746969465%7Ctwgr%5E1eb8631fb0d85bab7bf13948319316a104e513d5%7Ctwcon%5Es1_&ref_url=https%3A%2F%2Fwww.sportingnews.com%2Fus%2Fnba%2Fdallas-mavericks%2Fnews%2Fanthony-davis-trade-rumors-get-important-update-amid-nico-harrison-firing%2F4b4c41583ed61f3ce9c96fa4,Rich Paul has established a strong relationship with Mavericks owner Patrick Dumont since February's trade. They are in regular contact
2025-11-12,Anthony Davis,,youtube.com,"Zach Lowe: Anthony Davis — I mean, I can tell you teams are already having internal conversations like: ‘What would the price point be?’ ‘What do we think their price point is going to be?’ Obviously, this is a shell-shock time for the Mavericks’ new front office. I don’t think anything is really going on. It’s before December 15th — when free agents signed over the summer become eligible to be traded. Really, it’s almost impossible to make anything happen before then. YouTube Dallas Mavericks , Trade , Anthony Davis",https://www.youtube.com/watch?v=drA-fLU8HqA,"Anthony Davis — I mean, I can tell you teams are already having internal conversations like: ‘What would the price point be?’ ‘What do we think their price point is going to be?’"
2025-11-12,Anthony Davis,,youtube.com,"Zach Lowe: there's going to be Anthony Davis trade talks of some seriousness. Whether they result in a deal or not is impossible to say. I would bet on yes.” YouTube Dallas Mavericks , Trade , Anthony Davis",https://www.youtube.com/watch?v=9JJ31AQ7i-U,Whether they result in a deal or not is impossible to say. I would bet on yes.”
2025-11-12,Jalen Brunson,,youtube.com,"But there have been some basketball rumors floating around—specifically, about Giannis potentially coming to the Knicks. What are your thoughts about playing in Milwaukee? Jalen Brunson: I plead the fifth . YouTube Milwaukee Bucks , New York Knicks , Trade , Jalen Brunson",https://www.youtube.com/watch?v=drA-fLU8HqA,What are your thoughts about playing in Milwaukee? Jalen Brunson: I plead the fifth
2025-11-12,Domantas Sabonis,,youtube.com,"So when you're trying to trade for Sabonis, there's a team out there — and I heard about a team not too far down the road that could be interested. And when I say 'down the road,' I mean down the freeway — that team could look at a Domantas Sabonis. But again, he's not going to live up to that $40-whatever-million AAV there. He’s probably not going to do it anywhere. That team might be better with him, but he won’t be producing at that contract level. YouTube Sacramento Kings , Trade , Domantas Sabonis",https://www.youtube.com/watch?v=9kVvQwB5ReY,"when you're trying to trade for Sabonis, there's a team out there — and I heard about a team not too far down the road that could be interested. And when I say 'down the road,' I mean down the freeway — that team could look at a Domantas Sabonis."
2025-11-11,nan,,twitter.com,"Sactown Sports 1140: Is the first real, dedicated rebuild underway for the Sacramento Kings? @CarmichaelDave points to a few teams the Kings should look towards as examples as they navigate what lies ahead: Twitter Sacramento Kings , Trade",http://twitter.com/Sactown1140/status/1988278733221048563,@CarmichaelDave points to a few teams the Kings should look towards as examples as they navigate what lies ahead:
2025-11-11,Anthony Davis,,espn.com,"It's uncertain what the trade market for Anthony Davis would be due to his durability issues, although he is still a dominant force on both ends of the floor when healthy. Several league sources were adamant that determining that market over the upcoming months is due diligence that Dallas should do as it's become clear that Harrison's hopes of a three- to four-year window of contention won't come to fruition . ""You don't go two timelines anymore,"" a West executive said. ""You say, 'We're going to take what we can get [for Davis].' At this point, I'm not sure what they can get."" ESPN Dallas Mavericks , Trade , Anthony Davis",https://www.espn.com/nba/story/_/id/46930033/why-mavs-fired-nico-harrison-next-dallas,Several league sources were adamant that determining that market over the upcoming months is due diligence that Dallas should do as it's become clear that Harrison's hopes of a three- to four-year window of contention won't come to fruition
2025-11-11,Cooper Flagg,,si.com,"Then there is Jason Kidd. Kidd is in good standing in Dallas, both with ownership—which has extended him twice—and a fan base that remembers how Kidd helped deliver a championship as a player and steer the team to the Finals as a coach. His hands are (publicly, at least) clean in the Dončić deal—Harrison gave him cover when he said he didn’t inform Kidd of the trade until it was completed—and no one is pointing fingers his way for the flop of the Mavs’ injury-riddled roster. Under a Kidd regime, Dirk Nowitzki could be brought back into the fold. Will Kidd want the job? Probably, people who know Kidd say. Kidd has craved input in personnel decisions at previous stops. And while he has come into his own as a coach in Dallas, a rebuild around Flagg is inevitable. Better to oversee it from an executive office than the coach’s box. Sports Illustrated Dallas Mavericks , Trade , Dirk Nowitzki , Jason Kidd",https://www.si.com/nba/mavericks-had-to-fire-nico-harrison-after-luka-doncic-trade-debacle,"Will Kidd want the job? Probably, people who know Kidd say. Kidd has craved input in personnel decisions at previous stops."
2025-11-11,Anthony Davis,,nytimes.com,"The developments that followed in Dallas, (somewhat) predictable though they might have been, were the kind of things you simply can’t make up. As our Mavericks beat writer, Christian Clark, chronicled here, Anthony Davis came into training camp overweight before later suffering a calf strain that caused concern within the organization. Sound familiar? That’s precisely what went down with Dončić in those weeks and months before the trade. New York Times Dallas Mavericks , Trade , Anthony Davis , Training Camp",https://www.nytimes.com/athletic/6798731/2025/11/11/nico-harrison-demise-donic-trade-mavericks/,"As our Mavericks beat writer, Christian Clark, chronicled here, Anthony Davis came into training camp overweight before later suffering a calf strain that caused concern within the organization."
2025-11-10,Ja Morant,,sportskeeda.com,"Krawczynski added that, while nothing is definite at the moment, it's likely that the Timberwolves will make a push to acquire Morant in the next few months. ""They're testing the waters a little bit. I don't get the sense that there's anything real close,"" he clarified. ""I do think that, if we get to late December and the Wolves are still treading water and that point guard position still has not solidified...I do think that they could explore at least looking harder at Ja Morant."" SportsKeeda Memphis Grizzlies , Minnesota Timberwolves , Trade , Ja Morant",https://www.sportskeeda.com/basketball/news-ja-morant-trade-rumors-nba-writer-reveals-timberwolves-checking-in-grizzlies-land-controversial-star-amid-desperate-need-pg,"""They're testing the waters a little bit. I don't get the sense that there's anything real close,"" he clarified. ""I do think that, if we get to late December and the Wolves are still treading water and that point guard position still has not solidified...I do think that they could explore at least looking harder at Ja Morant."""
2025-11-10,Karl-Anthony Towns,,dunkingwithwolves.com,"Even still, some people (not necessarily Wolves fans) are wondering if Randle could be traded again, given Minnesota's need for a point guard and surplus of frontcourt players. Recently, to the delight of Wolves fans, trusted NBA insider Jake Fischer shut down these rumors. ""They [Minnesota] also really value Julius Randle being a secondary playmaker/creator next to Ant, taking some of the pressure off him as a primary ball-handler, Fischer said. That was something that they valued in that trade that sent Karl-Anthony Towns to the Knicks. I really don't see them looking to trade Randle at all."" Dunking with Wolves Minnesota Timberwolves , New York Knicks , Trade , Julius Randle , Karl-Anthony Towns",https://dunkingwithwolves.com/nba-insider-gives-definitive-take-on-timberwolves-interest-in-trading-julius-randle,"I really don't see them looking to trade Randle at all."""
2025-11-10,Ja Morant,,x.com,"SiriusXM NBA Radio: “It’s Pat Riley’s home for distressed players”? @IraHeatBeat tells @TheFrankIsola & @Scalabrine the Heat could be a good landing spot for Ja Morant . x.com Memphis Grizzlies , Miami Heat , Trade , Ja Morant",https://x.com/SiriusXMNBA/status/1986863508575674391,@IraHeatBeat tells @TheFrankIsola & @Scalabrine the Heat could be a good landing spot for Ja Morant
2025-11-09,Amen Thompson,,nbcsports.com,"As written about this week at NBC Sports, league sources have told us there is not much of a trade market for Morant right now, and any offers for him at this point would be lowball ones looking for a steal. Minnesota and Sacramento are reportedly interested, not Houston (why take the ball out of the hands of Amen Thompson and Kevin Durant? The Rockets need a floor general at the point). Memphis is in a tough spot because Morant is still a player people pay to see in a small market, and the business side of the equation matters, as Tim Bontemps mentions at ESPN. NBC Sports Memphis Grizzlies , Trade",https://www.nbcsports.com/nba/news/trade-rumor-roundup-market-not-strong-for-zion-williamson-ja-morant-lamelo-ball,"league sources have told us there is not much of a trade market for Morant right now,"
2025-11-08,Lamelo Ball,,espn.com,"All of it, though, begins with Ball, an extraordinary talent who has people around the league questioning whether the sum will ever equal the many intriguing parts: a 6-7 frame, deep shooting range and incredible playmaking vision and open floor ability. ""He still doesn't know who he is,"" a Western Conference scout said. ""But I think you can justify buying into the talent."" That is why trying to come up with a proper gauge of Ball's trade value is nearly impossible. He has played in just 58.1% of Charlotte's games since being drafted No. 3 in 2020, and outside of one blowout loss in a play-in game, the Hornets haven't sniffed the playoffs. ""Yes, he's talented, but he doesn't take basketball seriously enough,"" another West scout said. ""It's hard to build a winner with him because of how he plays, and the liberties he takes for himself when he plays. ""Would someone take a flier on him? For sure. But Charlotte isn't taking a flier price for him."" ESPN Charlotte Hornets , Trade , LaMelo Ball",https://www.espn.com/nba/story/_/id/46874485/nba-intel-trade-talks-next-ja-morant-zion-williamson-trae-young-lamelo-ball,"""Yes, he's talented, but he doesn't take basketball seriously enough,"" another West scout said."
2025-11-07,Ja Morant,,x.com,"7PM in Brooklyn: If Ja Morant is moved, Melo likes Miami & Milwaukee as possible landing spots ? ""He needs to go somewhere that's already centered around culture."" x.com Memphis Grizzlies , Miami Heat , Milwaukee Bucks , Brooklyn Nets , Trade , Carmelo Anthony , Ja Morant",https://x.com/7PMinBrooklyn/status/1986567535815245936,"Ja Morant is moved, Melo likes Miami & Milwaukee as possible landing spots ?"
2025-11-07,Jaren Jackson Jr,,espn.com,"The other question sources around the league are asking is whether the Grizzlies, at some point this season, would entertain moving on from Jaren Jackson Jr, as well, if they choose to end their partnership with Morant . While there's a clear consensus that there wouldn't be much of a market for Morant, Jackson -- a floor-spacing, rim-protecting big -- would certainly appeal to plenty of clubs, especially given he's now under contract through 2030, and thus even small-market teams could pursue him and know he would be sticking around. ESPN Memphis Grizzlies , Trade , Jaren Jackson Jr",https://www.espn.com/nba/story/_/id/46874485/nba-intel-trade-talks-next-ja-morant-zion-williamson-trae-young-lamelo-ball,"The other question sources around the league are asking is whether the Grizzlies, at some point this season, would entertain moving on from Jaren Jackson Jr, as well, if they choose to end their partnership with Morant"
2025-11-07,Ja Morant,,espn.com,"Morant, whose shooting percentages are at career-worst levels, seems to still be in the skeptical camp. That is believed to be a core issue in the player and coach's locker room back-and-forth that preceded Sunday's suspension. ""His system is based on having an elite guard who has the ability to get his feet into the paint, and then all his strategy evolves from that. Morant should be a very good fit for it, [Iisalo] was surely excited about that when he got that job,"" a European executive, who knows Iisalo's game plans well, told ESPN. ""He is running his system there. But it is not creating the advantages that are expected yet."" ESPN Memphis Grizzlies , Trade , Ja Morant , Tuomas Iisalo",https://www.espn.com/nba/story/_/id/46874485/nba-intel-trade-talks-next-ja-morant-zion-williamson-trae-young-lamelo-ball,"Morant should be a very good fit for it, [Iisalo] was surely excited about that when he got that job,"" a European executive, who knows Iisalo's game plans well, told ESPN."
2025-11-07,Ja Morant,,espn.com,"In talking with various sources around the league, Morant is still viewed as a borderline top-10 player at the position -- and that's before factoring in the previous off-court issues -- but there aren't many teams around the league in need of a starting point guard. Morant also remains very popular in Memphis, a market players aren't exactly flocking to, and one in which Morant has repeatedly said he wants to remain. ""He sells shoes, he sells tickets, and he wants to play in Memphis when no one wants to,"" a Western Conference assistant coach said. ""So it makes for a really, really difficult situation."" ESPN Memphis Grizzlies , Trade , Ja Morant",https://www.espn.com/nba/story/_/id/46874485/nba-intel-trade-talks-next-ja-morant-zion-williamson-trae-young-lamelo-ball,"""He sells shoes, he sells tickets, and he wants to play in Memphis when no one wants to,"" a Western Conference assistant coach said. ""So it makes for a really, really difficult situation."""
2025-11-07,Trae Young,,espn.com,"As for LaMelo Ball... ""If you're asking me if Trae, Ja and LaMelo all came onto the trade market tomorrow, I think LaMelo would have the best market,"" one executive said. ""But that's all hypothetical right now."" ESPN Atlanta Hawks , Charlotte Hornets , Memphis Grizzlies , Trade , LaMelo Ball , Trae Young , Ja Morant",https://www.espn.com/nba/story/_/id/46874485/nba-intel-trade-talks-next-ja-morant-zion-williamson-trae-young-lamelo-ball,"""If you're asking me if Trae, Ja and LaMelo all came onto the trade market tomorrow, I think LaMelo would have the best market,"" one executive said."
2025-11-07,Trae Young,,espn.com,"Trae Young is on the final guaranteed year of his contract ($46 million) but has a player option next season for $49 million. He is the Hawks' franchise player. They can sign him to an extension at any time, sources told ESPN that those talks haven't progressed . That is likely because it's hard to determine a market value for Young. He's a four-time All-Star and led the league in assists per game (11.6) last season. Over the past four years being built primarily around Young, the Hawks have averaged a modest 40 wins and haven't been over .500 since 2021-22. ESPN Atlanta Hawks , Trade , Trae Young",https://www.espn.com/nba/story/_/id/46874485/nba-intel-trade-talks-next-ja-morant-zion-williamson-trae-young-lamelo-ball,"They can sign him to an extension at any time, sources told ESPN that those talks haven't progressed"
2025-11-07,Zion Williamson,,espn.com,"It wasn't the first October where this concept emanated from New Orleans, but Williamson backed it up by saying he felt the best physically since his jaw-dropping lone season at Duke in 2018-19. Now, less than three weeks into the season, he is missing time with the fifth significant hamstring injury of his career. ""Joe is smart, he knew the only rational move was to motivate Zion,"" another executive said. ""He's still only 25. With a player like that, you have to exhaust all options to try to make it work."" ESPN New Orleans Pelicans , Trade , Joe Dumars , Zion Williamson",https://www.espn.com/nba/story/_/id/46874485/nba-intel-trade-talks-next-ja-morant-zion-williamson-trae-young-lamelo-ball,"""Joe is smart, he knew the only rational move was to motivate Zion,"" another executive said. ""He's still only 25. With a player like that, you have to exhaust all options to try to make it work."""
2025-11-07,Zion Williamson,,espn.com,"Stated simply, even with his unusual non-guaranteed contract over the next two years that offers the franchise protection, Zion Williamson's trade value isn't super high . ""To be honest, their move might be a win-now trade, not a Zion trade,"" a rival executive said. ""His trade value isn't there and they are facing some pressure to win."" ESPN New Orleans Pelicans , Trade , Zion Williamson",https://www.espn.com/nba/story/_/id/46874485/nba-intel-trade-talks-next-ja-morant-zion-williamson-trae-young-lamelo-ball,"Stated simply, even with his unusual non-guaranteed contract over the next two years that offers the franchise protection, Zion Williamson's trade value isn't super high"
2025-11-07,PLAYER,,youtube.com,"Shams Charania: You need to also have teams that can go eight, nine, 10 players’ deep in the playoffs. I think, it has become increasingly important. And that means, yeah, I think having teams that are built around maybe one or two mega stars and then a team full of just dogs and two-way players. I think we have seen that shift. And I do wonder how much of that shift also just by necessity of the second apron in the first apron and teams wanting to stay out of those aprons because you know if you're in the second apron for more than a year or two you're basically in basketball hell. YouTube Trade",https://www.youtube.com/watch?v=_kwwp3RoKiY,And I do wonder how much of that shift also just by necessity of the second apron in the first apron and teams wanting to stay out of those aprons because you know if you're in the second apron for more than a year or two you're basically in basketball hell.
2025-11-07,PLAYER,,youtube.com,"Shams Charania: I always loved the NBA and for me, it was like I wanted to find my way covering the NBA and initially it was a lot of analysis stories and it was like as if I was doing game recap stories, but at the same time I was obsessed with ‘where's this guy being traded to? Where's this player signing? Is this coach going to get fired?’ This team is struggling. What's really going on with this team? If this team is doing really well, like what are the reasons? I was just always curious about that. I would be refreshing RealGM and HoopsHype about these rumors over and over again. And that led me to this path of like, ‘hey, I want to find out what's going on here. I want to know where this player is being traded.’ YouTube Trade , HoopsHype , Shams Charania",https://www.youtube.com/watch?v=_kwwp3RoKiY&t=271s,"I would be refreshing RealGM and HoopsHype about these rumors over and over again. And that led me to this path of like, ‘hey, I want to find out what's going on here. I want to know where this player is being traded.’"
2025-11-07,Ja Morant,,youtube.com,"Carmelo Anthony on Ja Morant: They're not going to let you get their train f*ck they train up anymore, right?  We let you f*ck your train up, right? We ain't going to let you f*ck our train up. So, it's a real unfortunate situation to be in. I don't know the situation. I just know what I know about the situation from what I see. You can see it as a player. You see the different bounce that Ja got. You see the how he moving. You see the like that ‘it’ factor. You don't see that right now. Because it's you in this lost environment. You're in this lost environment here (mentally). They f*ck with you. The team f*ck with you. The coach f*ck with you. It's a power struggle now because you had the power and now they trying to take back the power. This is a prime example. When they ready to take back the power, I've always said this, they will take back the power . YouTube Memphis Grizzlies , Trade , Carmelo Anthony , Ja Morant",https://www.youtube.com/watch?v=1BMp3A66S0I,"This is a prime example. When they ready to take back the power, I've always said this, they will take back the power"
